{
  "schemaVersion": "1.0.0",
  "class": {
    "id": "2027-12is1",
    "label": "12IS1 2027",
    "courseId": "y12-investigating-science",
    "year": "2027",
    "updatedAt": "2026-07-24T00:00:00Z"
  },
  "entries": [
    {
      "id": "entry-demo-1",
      "nodeId": "m5-iq1-o1",
      "parentEntryId": null,
      "entryType": "example",
      "author": {
        "id": "student-demo",
        "displayName": "Maya R. \u2014 12IS1",
        "firstName": "Maya",
        "lastInitial": "R.",
        "className": "12IS1",
        "role": "student",
        "avatarInitials": "MR",
        "avatarColour": "hsl(188 42% 43%)"
      },
      "body": "A strong hypothesis identifies a testable relationship between an independent and dependent variable.",
      "createdAt": "2026-07-24T00:00:00Z",
      "updatedAt": "2026-07-24T00:00:00Z",
      "status": "published",
      "curation": {
        "isTeacherRecommended": true,
        "promotedFromEntryId": null,
        "curatedBy": "Teacher",
        "curatedAt": "2026-07-24T00:00:00Z",
        "reason": "Clear and syllabus-aligned."
      },
      "tags": [
        "hypothesis"
      ],
      "sourceLinks": [],
      "flashcardEligible": true,
      "studyBuddyEligible": true
    },
    {
      "id": "entry-demo-2",
      "nodeId": "m5-iq1-o2",
      "parentEntryId": null,
      "entryType": "teacher-highlight",
      "author": {
        "id": "teacher",
        "displayName": "Teacher",
        "firstName": "",
        "lastInitial": "",
        "className": "",
        "role": "teacher",
        "avatarInitials": "T",
        "avatarColour": "hsl(43 55% 43%)"
      },
      "body": "Validity is about whether the investigation actually tests the intended question or hypothesis.",
      "createdAt": "2026-07-24T00:00:00Z",
      "updatedAt": "2026-07-24T00:00:00Z",
      "status": "published",
      "curation": {
        "isTeacherRecommended": true,
        "promotedFromEntryId": null,
        "curatedBy": "Teacher",
        "curatedAt": "2026-07-24T00:00:00Z",
        "reason": "Core clarification."
      },
      "tags": [
        "validity"
      ],
      "sourceLinks": [],
      "flashcardEligible": true,
      "studyBuddyEligible": true
    }
  ],
  "reactions": [
    {
      "entryId": "entry-demo-1",
      "reactionType": "helpful",
      "count": 3,
      "reactorIds": []
    }
  ]
}